amazon_search_url,asin,currency,discount_pct,image_urls,images,name,num_of_ratings,price,search_term,search_term_id,star_rating,url
https://www.amazon.com/s?k=High+Top+Boxing+Shoes,B07C4F498L,$,,https://m.media-amazon.com/images/I/61ibXqJztiL._AC_UL1500_.jpg,,"New Elite High Top Boxing Shoes - Black, Blue, Red",625,99.79,High Top Boxing Shoes,nan,4.7,https://www.amazon.com/Everlast-Elite-High-Boxing-Shoes/dp/B07C4F498L
https://www.amazon.com/s?k=High+Top+Boxing+Shoes,B007YJYJT8,$,-17.0,https://m.media-amazon.com/images/I/813w4b48n-L._AC_UL1500_.jpg,,Undefeated Wrestling Boxing Shoes,410,66.05,High Top Boxing Shoes,nan,4.5,https://www.amazon.com/Ringside-High-Boxing-Shoe-Black/dp/B007YJYJT8
https://www.amazon.com/s?k=High+Top+Boxing+Shoes,B01N6KOR8C,$,,https://m.media-amazon.com/images/I/61MQ-Cd0-rL._AC_UL1500_.jpg,,Title Speed-Flex Encore Tall Boxing Shoes Size 10 Black,37,54.99,High Top Boxing Shoes,nan,4.7,https://www.amazon.com/TITLE-Speed-Flex-Encore-Boxing-Shoes/dp/B01N6KOR8C
https://www.amazon.com/s?k=High+Top+Boxing+Shoes,B01MY22HQD,$,,https://m.media-amazon.com/images/I/61MQ-Cd0-rL._AC_UL1500_.jpg,,Title Speed-Flex Encore Tall Boxing Shoes Size 7 Black,10,54.99,High Top Boxing Shoes,nan,3.9,https://www.amazon.com/TITLE-Speed-Flex-Encore-Boxing-Shoes/dp/B01MY22HQD
https://www.amazon.com/s?k=High+Top+Boxing+Shoes,B09DG1J9H5,$,,https://m.media-amazon.com/images/I/71HEB9csE+L._AC_UL1500_.jpg,,FISTRAGE Leather Kick Boxing Shoes Fighting Sports Master Training Mesh Unisex Pro Men's and Youth Genuine Boot Light Weight | Black Color Boxing Shoes for Adults,198,43.99,High Top Boxing Shoes,nan,4.2,https://www.amazon.com/FISTRAGE-Leather-Fighting-Training-High-Top/dp/B09DG1J9H5
https://www.amazon.com/s?k=High+Top+Boxing+Shoes,B09TW57678,$,,https://m.media-amazon.com/images/I/71HEB9csE+L._AC_UL1500_.jpg,,FISTRAGE Leather High Top Kick Boxing Shoes Fighting Sports Training Mesh Unisex Pro Men's and Youth Light Weight | Black Color Boxing Shoes for Adults,19,44.99,High Top Boxing Shoes,nan,4.1,https://www.amazon.com/FISTRAGE-Leather-Fighting-Training-High-Top/dp/B09TW57678
https://www.amazon.com/s?k=High+Top+Boxing+Shoes,B09BQPDZW2,$,,https://m.media-amazon.com/images/I/716p86i1SFS._AC_UL1500_.jpg,,Youth Sports Boxing Shoes Breathable Men‘s Wrestling Shoes Fitness Sanda Shoes Ankle Guard Squat Shoes Non-Slip Fighting Shoes High-top Training Competition Shoes for Men Bodybuilding Boots,9,54.99,High Top Boxing Shoes,nan,4.8,https://www.amazon.com/HUANLE-Breathable-Wrestling-Competition-Bodybuilding/dp/B09BQPDZW2
https://www.amazon.com/s?k=High+Top+Boxing+Shoes,B07YFMSTVS,$,,https://m.media-amazon.com/images/I/61BPYodMQhL._AC_UL1500_.jpg,,High Top Boxing Shoes Boxer Boots for Men Women Kids Red,2,55.0,High Top Boxing Shoes,nan,4.4,https://www.amazon.com/Sport-Pioneer-Boxing-Shoes-Boxer/dp/B07YFMSTVS
https://www.amazon.com/s?k=High+Top+Boxing+Shoes,B007YJYNY4,$,,https://m.media-amazon.com/images/I/81jaTXVDymL._AC_UL1500_.jpg,,Diablo Wrestling Boxing Shoes,219,69.99,High Top Boxing Shoes,nan,4.1,https://www.amazon.com/Ringside-Top-Boxing-Shoe-Black/dp/B007YJYNY4
https://www.amazon.com/s?k=High+Top+Boxing+Shoes,B07N33NRM8,$,,https://m.media-amazon.com/images/I/61io3HZ3gDL._AC_UL1500_.jpg,,Apex Elite Boxing Shoes,56,114.99,High Top Boxing Shoes,nan,4.0,https://www.amazon.com/Ringside-Elite-Boxing-Shoes/dp/B07N33NRM8
https://www.amazon.com/s?k=High+Top+Boxing+Shoes,B07YFPFLFS,$,,https://m.media-amazon.com/images/I/61BPYodMQhL._AC_UL1500_.jpg,,High Top Boxing Shoes Boxer Boots for Men Women Kids,18,55.0,High Top Boxing Shoes,nan,3.8,https://www.amazon.com/Sport-Pioneer-Boxing-Shoes-Boxer/dp/B07YFPFLFS
https://www.amazon.com/s?k=High+Top+Boxing+Shoes,B096M6RWPD,$,,https://m.media-amazon.com/images/I/716p86i1SFS._AC_UL1500_.jpg,,High Traction Men's Sports Boxing Shoes Fitness Training Shoes Sanda Shoes High-top Combat Speed Wrestling Mens Women Breathable Weightlifting Training Shoes,4,54.99,High Top Boxing Shoes,nan,5.0,https://www.amazon.com/Wanban-Traction-Wrestling-Breathable-Weightlifting/dp/B096M6RWPD
https://www.amazon.com/s?k=High+Top+Boxing+Shoes,B0B2B1XXS8,$,,https://m.media-amazon.com/images/I/611aqZofTDL._AC_UL1500_.jpg,,Men's Women's Sneakers Boxing Wrestling Shoes Squat Non-Slip Rubber Sole Men's Fighting High Top Boxing Shoes Gymnastics Shoes,1,59.99,High Top Boxing Shoes,nan,5.0,https://www.amazon.com/Sneakers-Wrestling-Non-Slip-Fighting-Gymnastics/dp/B0B2B1XXS8
https://www.amazon.com/s?k=High+Top+Boxing+Shoes,B09984C5MZ,$,,https://m.media-amazon.com/images/I/61PyxxvWk5S._AC_UL1500_.jpg,,Breathable Men's High Top Wrestling Boxing Shoes High Traction Combat Speed Boxing Boots Non-Slip Fighting Training Competition Sports Shoes Men's Athletic Casual Shoes Gym Boots,8,50.99,High Top Boxing Shoes,nan,3.8,https://www.amazon.com/HUANLE-Traction-Wrestling-Breathable-Competition/dp/B09984C5MZ
https://www.amazon.com/s?k=High+Top+Boxing+Shoes,B07K8LNRJR,$,,https://m.media-amazon.com/images/I/519B6SyD1tL._AC_UL1500_.jpg,,High Top Boxing Shoes Boxer Boots for Men Women Kids Red,1,55.0,High Top Boxing Shoes,nan,5.0,https://www.amazon.com/Sport-Pioneer-Boxing-Shoes-Boxer/dp/B07K8LNRJR
https://www.amazon.com/s?k=High+Top+Boxing+Shoes,B09X7CXLQT,$,,https://m.media-amazon.com/images/I/61Mbtk1P0-S._AC_UL1500_.jpg,,"Boxing Wrestling Shoes, High Top Boxers Trainers Footwear Rubber Sole Lace Up Breathable Taekwondo Sport Shoes",,90.99,High Top Boxing Shoes,nan,,https://www.amazon.com/WJFGGXHK-Wrestling-Trainers-Breathable-Taekwondo/dp/B09X7CXLQT
https://www.amazon.com/s?k=High+Top+Boxing+Shoes,B08T9K4FF7,$,,https://m.media-amazon.com/images/I/71fCZJJ2w3L._AC_UL1500_.jpg,,High Top Mens Wrestling Boxing Shoes Non-Slip Breathable Boxing Wrestling Training Shoes for Men Women Sport Athletic Casual Shoes,10,54.99,High Top Boxing Shoes,nan,4.6,https://www.amazon.com/QIAO-Wrestling-Non-Slip-Breathable-Black-Gold/dp/B08T9K4FF7
https://www.amazon.com/s?k=High+Top+Boxing+Shoes,B07YFRMFLY,$,-16.0,https://m.media-amazon.com/images/I/61rflOIoi+L._AC_UL1500_.jpg,,Men's Tennis Lightweight Athletics Gym Jogging Sneakers,25599,41.99,High Top Boxing Shoes,nan,4.4,https://www.amazon.com/BRONAX-Waterproof-Crossfit-Wrestling-Training/dp/B07YFRMFLY
https://www.amazon.com/s?k=High+Top+Boxing+Shoes,B06XWYK3SV,$,,https://m.media-amazon.com/images/I/81O4c+VwDbL._AC_UL1500_.jpg,,Unisex-Adult Combat Speed.5,721,80.0,High Top Boxing Shoes,nan,4.6,https://www.amazon.com/adidas-Combat-Speed-5-Silver-Metallic/dp/B06XWYK3SV
https://www.amazon.com/s?k=High+Top+Boxing+Shoes,B08N7YGT73,$,-20.0,https://m.media-amazon.com/images/I/81vIHZqsAcS._AC_UL1500_.jpg,,Unisex-Adult Box Hog 3 Sneaker,381,80.0,High Top Boxing Shoes,nan,4.6,https://www.amazon.com/adidas-Unisex-Boxing-Royal-Collegiate/dp/B08N7YGT73
https://www.amazon.com/s?k=High+Top+Boxing+Shoes,B08X21JJ7G,$,,https://m.media-amazon.com/images/I/71mXeZTucjL._AC_UL1500_.jpg,,Men's Tech Fall 2.0 Wrestling Shoe,416,84.95,High Top Boxing Shoes,nan,4.6,https://www.amazon.com/adidas-Mens-Wrestling-White-Vegas/dp/B08X21JJ7G
https://www.amazon.com/s?k=High+Top+Boxing+Shoes,B091ZCDDVK,$,,https://m.media-amazon.com/images/I/71wAF-CZwVL._AC_UL1500_.jpg,,Unisex-Adult Speedex 18 Boxing Shoe,282,91.05,High Top Boxing Shoes,nan,4.6,https://www.amazon.com/adidas-Unisex-Speedex-Boxing-Metallic/dp/B091ZCDDVK
https://www.amazon.com/s?k=High+Top+Boxing+Shoes,B00Q77R5TO,$,-32.0,https://m.media-amazon.com/images/I/912QXOb8LSL._AC_UL1500_.jpg,,Men's Cael V6.0 Wrestling Shoe,575,64.97,High Top Boxing Shoes,nan,4.7,https://www.amazon.com/ASICS-Cael-Wrestling-Atomic-Yellow/dp/B00Q77R5TO
https://www.amazon.com/s?k=High+Top+Boxing+Shoes,B087TNR8NF,$,,https://m.media-amazon.com/images/I/81LbK3dKHYL._AC_UL1500_.jpg,,Women's HOVR Highlight Ace Volleyball Shoe,312,125.0,High Top Boxing Shoes,nan,4.7,https://www.amazon.com/Under-Armour-Womens-Highlight-White/dp/B087TNR8NF
https://www.amazon.com/s?k=High+Top+Boxing+Shoes,B089SJ5XH6,$,,https://m.media-amazon.com/images/I/613O1FBybDS._AC_UL1500_.jpg,,JB Elite V,288,124.95,High Top Boxing Shoes,nan,4.8,https://www.amazon.com/ASICS-Elite-Wrestling-Shoes-Black/dp/B089SJ5XH6
https://www.amazon.com/s?k=High+Top+Boxing+Shoes,B0947LWFMT,$,-5.0,https://m.media-amazon.com/images/I/61pMJ5KBcNS._AC_UL1500_.jpg,,Women's MATBLAZER Wrestling Shoes,70,109.45,High Top Boxing Shoes,nan,4.6,https://www.amazon.com/ASICS-Matblazer-White-Mist-9-5/dp/B0947LWFMT
https://www.amazon.com/s?k=High+Top+Boxing+Shoes,B08PVSJ2TC,$,,https://m.media-amazon.com/images/I/61mWsTKtnZL._AC_UL1500_.jpg,,Men's Jordan 1 Retro High OG Black/Metallic Gold-Black 2020 (555088 032),11,374.95,High Top Boxing Shoes,nan,4.2,https://www.amazon.com/Jordan-Mens-Retro-Black-Metallic/dp/B08PVSJ2TC
https://www.amazon.com/s?k=High+Top+Boxing+Shoes,B07K9CDZCB,$,-13.0,https://m.media-amazon.com/images/I/81h8LEsDoTL._AC_UL1500_.jpg,,Men's Matflex 6 Wrestling Shoes,5595,54.99,High Top Boxing Shoes,nan,4.4,https://www.amazon.com/ASICS-Matflex-Wrestling-Shoes-Silver/dp/B07K9CDZCB
https://www.amazon.com/s?k=High+Top+Boxing+Shoes,B001O0SQO2,$,-12.0,https://m.media-amazon.com/images/I/61gmfoXDE5L._AC_UL1500_.jpg,,Men's Ex-o-fit Hi Sneaker,4113,74.76,High Top Boxing Shoes,nan,4.6,https://www.amazon.com/Reebok-Mens-EX-FIT-Black/dp/B001O0SQO2
https://www.amazon.com/s?k=High+Top+Boxing+Shoes,B083QT6RN5,$,,https://m.media-amazon.com/images/I/51VkFQZTGnL._AC_UL1500_.jpg,,Men's JB Elite IV Wrestling Shoes,1619,129.95,High Top Boxing Shoes,nan,4.7,https://www.amazon.com/ASICS-Elite-Wrestling-Shoes-White/dp/B083QT6RN5
https://www.amazon.com/s?k=High+Top+Boxing+Shoes,B0009AUDBM,$,,https://m.media-amazon.com/images/I/61nlK+TFKNL._AC_UL1500_.jpg,,Men's Stingray Escape Bodybuilding Weightlifting MMA & Wrestling Shoes,1967,109.0,High Top Boxing Shoes,nan,4.6,https://www.amazon.com/Otomix-Stingray-Escape-Bodybuilding-Wrestling/dp/B0009AUDBM
https://www.amazon.com/s?k=High+Top+Boxing+Shoes,B01NBOHGWJ,$,,https://m.media-amazon.com/images/I/41zJfzoTfsL._AC_UL1500_.jpg,,"TITLE BOXING Speed-Flex Encore Mid Boxing Shoes, Red, 11",17,54.99,High Top Boxing Shoes,nan,4.3,https://www.amazon.com/TITLE-Speed-Flex-Encore-Boxing-Shoes/dp/B01NBOHGWJ
https://www.amazon.com/s?k=High+Top+Boxing+Shoes,B01BPL5T12,$,-9.0,https://m.media-amazon.com/images/I/51ujhsCXuRL._AC_UL1500_.jpg,,Wrestling HVC Youth Laced Wrestling Shoe (Toddler/Little Kid/Big Kid),4399,54.78,High Top Boxing Shoes,nan,4.6,https://www.amazon.com/Adidas-Wrestling-Shoe-Black-White/dp/B01BPL5T12
https://www.amazon.com/s?k=High+Top+Boxing+Shoes,B07WK4XQ45,$,,https://m.media-amazon.com/images/I/61ySDHYKsVL._AC_UL1500_.jpg,,Men’s High Top Canvas Sneakers Lace Up Classic Casual Walking Shoes,4105,23.99,High Top Boxing Shoes,nan,4.4,https://www.amazon.com/ZGR-Canvas-Sneakers-Casual-Shoes/dp/B07WK4XQ45
https://www.amazon.com/s?k=High+Top+Boxing+Shoes,B08YMWV5FM,$,,https://m.media-amazon.com/images/I/71x4bT6gXuL._AC_UL1500_.jpg,,Men's Breathable Boxing Shoes Wrestling Shoes High-top Non-Slip Professional Training Shoes Squat Shoes(Chian Size),10,59.99,High Top Boxing Shoes,nan,3.9,https://www.amazon.com/Amoda-Breathable-Wrestling-High-top-Professional/dp/B08YMWV5FM
https://www.amazon.com/s?k=High+Top+Boxing+Shoes,B0126J8RAC,$,,https://m.media-amazon.com/images/I/91c3jNmaOkL._AC_UL1500_.jpg,,"Womens Eskiva High Metallic Casual Sneakers,",327,34.95,High Top Boxing Shoes,nan,4.4,https://www.amazon.com/PUMA-Womens-Eskiva-Metallic-Sneaker/dp/B0126J8RAC
https://www.amazon.com/s?k=High+Top+Boxing+Shoes,B07WMZQBP5,$,-36.0,https://m.media-amazon.com/images/I/61NAHiAJYcL._AC_UL1500_.jpg,,Mens Fashion Sneakers High Top Walking Shoes Sport Athletic Casual Shoe Vogue Stylish Men,3756,43.99,High Top Boxing Shoes,nan,4.1,https://www.amazon.com/Ahico-Fashion-Sneakers-Walking-Athletic/dp/B07WMZQBP5
https://www.amazon.com/s?k=High+Top+Boxing+Shoes,B0B1XK3KN6,$,,https://m.media-amazon.com/images/I/61GsuxPh3sL._AC_UL1500_.jpg,,Men's Womens Breathable Wrestling Shoes Non-Slip Ankle Guard Squat Boxing High Top Training Boots Athletic Gym Shoes,,59.99,High Top Boxing Shoes,nan,,https://www.amazon.com/Breathable-Wrestling-Non-Slip-Training-Athletic/dp/B0B1XK3KN6
https://www.amazon.com/s?k=High+Top+Boxing+Shoes,B07NQNCKTW,$,-9.0,https://m.media-amazon.com/images/I/61oAztaWNmL._AC_UL1500_.jpg,,HVC 2 Youth White/Red/Royal Wrestling Shoes 13,18,49.98,High Top Boxing Shoes,nan,4.6,https://www.amazon.com/adidas-Youth-White-Royal-Wrestling/dp/B07NQNCKTW
https://www.amazon.com/s?k=High+Top+Boxing+Shoes,B07PXV1FBC,$,,https://m.media-amazon.com/images/I/81zxaKAC_UL1500_.jpg,,Women's Highlight Ace 2.0 Volleyball Shoe,1544,124.99,High Top Boxing Shoes,nan,4.5,https://www.amazon.com/Under-Armour-Womens-Highlight-Volleyball/dp/B07PXV1FBC
https://www.amazon.com/s?k=High+Top+Boxing+Shoes,B09VQ4C4WK,$,,https://m.media-amazon.com/images/I/71Wny4PoUjL._AC_UL1500_.jpg,,Unisex-Adult Elite Boxing Shoes,508,150.36,High Top Boxing Shoes,nan,4.6,https://www.amazon.com/Venum-Sports-Outdoors-Boxing-Burgundy/dp/B09VQ4C4WK
https://www.amazon.com/s?k=High+Top+Boxing+Shoes,B083QV3ZMV,,,https://m.media-amazon.com/images/I/61HFAxSvwPL._AC_UL1500_.jpg,,Men's Matcontrol 2 Wrestling Shoes,802,,High Top Boxing Shoes,nan,4.6,https://www.amazon.com/ASICS-Matcontrol-Lite-Show-Wrestling-Shoes/dp/B083QV3ZMV
https://www.amazon.com/s?k=High+Top+Boxing+Shoes,B09X7C8ZN9,$,,https://m.media-amazon.com/images/I/61PPxMiCRbS._AC_UL1500_.jpg,,"Men's Boxing Shoes, Professional Wrestling Boots Breathable Non-Slip High-Top Weightlifting Training Shoes for Unisex",,55.99,High Top Boxing Shoes,nan,,https://www.amazon.com/WJFGGXHK-Professional-Wrestling-Breathable-Weightlifting/dp/B09X7C8ZN9
https://www.amazon.com/s?k=High+Top+Boxing+Shoes,B09DQ4YY83,,,https://m.media-amazon.com/images/I/61-feMRZw9L._AC_UL1500_.jpg,,Men's Breathable Boxing Wrestling Shoes High-top Combat Speed Boxing Boots Wrestling Shoes High-Top Non-Slip Rubber Sole Training Shoe,1,,High Top Boxing Shoes,nan,5.0,https://www.amazon.com/Anwant-Breathable-Wrestling-High-top-High-Top/dp/B09DQ4YY83
https://www.amazon.com/s?k=High+Top+Boxing+Shoes,B0841TY3NR,$,-27.0,https://m.media-amazon.com/images/I/61FWce-5WTL._AC_UL1500_.jpg,,Mens Fashion Sneaker Stylish Running Shoes for Casual Sports Athletic Walking Shoe,2112,43.88,High Top Boxing Shoes,nan,4.4,https://www.amazon.com/Fashion-Sneaker-Stylish-Running-Athletic/dp/B0841TY3NR
https://www.amazon.com/s?k=High+Top+Boxing+Shoes,B0B12GKN99,$,,https://m.media-amazon.com/images/I/61z11ARZuRL._AC_UL1500_.jpg,,High Top Combat Speed Mens Womens Wrestling Shoes Non-Slip Breathable Boxing Wrestling Training Sneaker,,79.99,High Top Boxing Shoes,nan,,https://www.amazon.com/DWZRG-Wrestling-Non-Slip-Breathable-Training/dp/B0B12GKN99
https://www.amazon.com/s?k=High+Top+Boxing+Shoes,B07BHYD3JC,,,https://m.media-amazon.com/images/I/61kBgbhyhpL._AC_UL1500_.jpg,,Men's Mat Wizard 4 Wrestling Shoe,1190,,High Top Boxing Shoes,nan,4.6,https://www.amazon.com/adidas-Wizard-Wrestling-Shoes-Carbon/dp/B07BHYD3JC
https://www.amazon.com/s?k=High+Top+Boxing+Shoes,B01BPL5XRM,$,-13.0,https://m.media-amazon.com/images/I/61TaebYLZyL._AC_UL1500_.jpg,,"Men's HVC Wrestling Shoe, Black/White/Iron Metallic, 13",216,52.48,High Top Boxing Shoes,nan,4.6,https://www.amazon.com/Adidas-Wrestling-Ankle-Strap-Black/dp/B01BPL5XRM
https://www.amazon.com/s?k=High+Top+Boxing+Shoes&page=2&qid=1661366320&ref=sr_pg_1,B09B47K7SV,,,https://m.media-amazon.com/images/I/71LDQnUi3UL._AC_UL1500_.jpg,,Men's Breathable Boxing Wrestling Shoes High-top Combat Speed Boxing Boots Wrestling Shoes High-Top Non-Slip Rubber Sole Training Shoe,,,High Top Boxing Shoes,nan,,https://www.amazon.com/Anwant-Breathable-Wrestling-High-top-High-Top/dp/B09B47K7SV
https://www.amazon.com/s?k=High+Top+Boxing+Shoes&page=2&qid=1661366320&ref=sr_pg_1,B01NCPZ2VQ,$,,https://m.media-amazon.com/images/I/71RIj29PWuL._AC_UL1500_.jpg,,"Title Speed-Flex Encore Mid Boxing Shoes, Black, 8",56,54.99,High Top Boxing Shoes,nan,4.2,https://www.amazon.com/Title-Speed-Flex-Encore-Boxing-Shoes/dp/B01NCPZ2VQ
https://www.amazon.com/s?k=High+Top+Boxing+Shoes&page=2&qid=1661366320&ref=sr_pg_1,B09VPDG8R2,$,,https://m.media-amazon.com/images/I/81wA6rvnN2L._AC_UL1500_.jpg,,"Undefeated Boxing Shoes, Boxing Boots; Well Balanced Grip & Pivot",,84.99,High Top Boxing Shoes,nan,,https://www.amazon.com/Undefeated-Dr-Boxing-Balanced-us_footwear_size_system/dp/B09VPDG8R2
https://www.amazon.com/s?k=High+Top+Boxing+Shoes&page=2&qid=1661366320&ref=sr_pg_1,B09DQ4YY83,,,https://m.media-amazon.com/images/I/61-feMRZw9L._AC_UL1500_.jpg,,Men's Breathable Boxing Wrestling Shoes High-top Combat Speed Boxing Boots Wrestling Shoes High-Top Non-Slip Rubber Sole Training Shoe,1,,High Top Boxing Shoes,nan,5.0,https://www.amazon.com/Anwant-Breathable-Wrestling-High-top-High-Top/dp/B09DQ4YY83
https://www.amazon.com/s?k=High+Top+Boxing+Shoes&page=2&qid=1661366320&ref=sr_pg_1,B082W4T5PP,,,https://m.media-amazon.com/images/I/81BaweX0HeL._AC_UL1500_.jpg,,Harden Stepback Basketball Shoe,3286,,High Top Boxing Shoes,nan,4.4,https://www.amazon.com/adidas-Harden-Stepback-Indoor-Metallic/dp/B082W4T5PP
https://www.amazon.com/s?k=High+Top+Boxing+Shoes&page=2&qid=1661366320&ref=sr_pg_1,B09TFFKCKP,$,,https://m.media-amazon.com/images/I/61VOB+CNleL._AC_UL1500_.jpg,,Men's Wresting Shoes High Traction Combat Speed Boxing Fitness Shoes Squat Deadlift Sanda Fighting Training Shoes High-Top Sports Shoes for Men Women Youth Bodybuilding Boots Black White,,55.99,High Top Boxing Shoes,nan,,https://www.amazon.com/HUIGOU-Wresting-Traction-Deadlift-Bodybuilding/dp/B09TFFKCKP
https://www.amazon.com/s?k=High+Top+Boxing+Shoes&page=2&qid=1661366320&ref=sr_pg_1,B007O1B9DU,$,-19.0,https://m.media-amazon.com/images/I/61PypN3dP0L._AC_UL1500_.jpg,,Power Boxing Shoes,127,60.37,High Top Boxing Shoes,nan,4.2,https://www.amazon.com/Ringside-Power-Wrestling-Boxing-Shoes/dp/B007O1B9DU
https://www.amazon.com/s?k=High+Top+Boxing+Shoes&page=2&qid=1661366320&ref=sr_pg_1,B0B1DH4F6P,$,,https://m.media-amazon.com/images/I/61Pa68jrMeL._AC_UL1500_.jpg,,Mens Womens High Top Wrestling Boxing Shoes Non-Slip Breathable High Traction Combat Boxing Wrestling Training Shoes,,79.99,High Top Boxing Shoes,nan,,https://www.amazon.com/DWZRG-Wrestling-Non-Slip-Breathable-Traction/dp/B0B1DH4F6P
https://www.amazon.com/s?k=High+Top+Boxing+Shoes&page=2&qid=1661366320&ref=sr_pg_1,B07MK6Y7NW,$,,https://m.media-amazon.com/images/I/61TAr34gaVL._AC_UL1500_.jpg,,Men's Stylish Sneakers High Top Athletic-Inspired Shoes,9871,41.99,High Top Boxing Shoes,nan,4.3,https://www.amazon.com/JOOMRA-Fashion-Sneakers-Basketball-Athletic/dp/B07MK6Y7NW
https://www.amazon.com/s?k=High+Top+Boxing+Shoes&page=2&qid=1661366320&ref=sr_pg_1,B0875S44V3,$,-14.0,https://m.media-amazon.com/images/I/81ciE-REvyL._AC_UL1500_.jpg,,Women's Crazyflight Mid Volleyball Shoe,417,119.99,High Top Boxing Shoes,nan,4.7,https://www.amazon.com/adidas-Womens-Crazyflight-Black-White/dp/B0875S44V3
https://www.amazon.com/s?k=High+Top+Boxing+Shoes&page=2&qid=1661366320&ref=sr_pg_1,B08R3YLG2Y,$,,https://m.media-amazon.com/images/I/414dP5MAe8L._AC_UL1500_.jpg,,"Wrestling Shoes for Men and Women, Top Combat Speed Mens Weightlifting, Powerlifting, Workout, MMA, Boxing Boots, Lightweight, Easy to Wear, Non Slip Red and Black Shoe",96,60.0,High Top Boxing Shoes,nan,4.1,https://www.amazon.com/Ninja-viking-Weightlifting-Powerlifting-Lightweight/dp/B08R3YLG2Y
https://www.amazon.com/s?k=High+Top+Boxing+Shoes&page=2&qid=1661366320&ref=sr_pg_1,B09Z6ZRHLQ,$,,https://m.media-amazon.com/images/I/71pFtwwCzxL._AC_UL1500_.jpg,,"High Top Kickboxing Shoes, Unisex Boxing Shoe Lightweight Wrestling Boots Non-Slip Wrestling Boots for Adults Junior Youth",,84.04,High Top Boxing Shoes,nan,,https://www.amazon.com/WJFGGXHK-Kickboxing-Lightweight-Wrestling-Non-Slip/dp/B09Z6ZRHLQ
https://www.amazon.com/s?k=High+Top+Boxing+Shoes&page=2&qid=1661366320&ref=sr_pg_1,B07457ZBHL,$,,https://m.media-amazon.com/images/I/51MvRaJkcsS._AC_UL1500_.jpg,,Mens Inflict 3 Wrestling Shoes,54,160.96,High Top Boxing Shoes,nan,4.5,https://www.amazon.com/Nika-Inflict-Wrestling-Shoes-Black/dp/B07457ZBHL
https://www.amazon.com/s?k=High+Top+Boxing+Shoes&page=2&qid=1661366320&ref=sr_pg_1,B01NBOHGWJ,$,,https://m.media-amazon.com/images/I/41zJfzoTfsL._AC_UL1500_.jpg,,"TITLE BOXING Speed-Flex Encore Mid Boxing Shoes, Red, 11",17,54.99,High Top Boxing Shoes,nan,4.3,https://www.amazon.com/TITLE-Speed-Flex-Encore-Boxing-Shoes/dp/B01NBOHGWJ
https://www.amazon.com/s?k=High+Top+Boxing+Shoes&page=2&qid=1661366320&ref=sr_pg_1,B09J94ZGHJ,,,https://m.media-amazon.com/images/I/41rpVNUvKmS._AC_UL1500_.jpg,,Men's Breathable Boxing Wrestling Shoes High-top Combat Speed Boxing Boots Wrestling Shoes High-Top Non-Slip Rubber Sole Training Shoe,,,High Top Boxing Shoes,nan,,https://www.amazon.com/Anwant-Breathable-Wrestling-High-top-High-Top/dp/B09J94ZGHJ
https://www.amazon.com/s?k=High+Top+Boxing+Shoes&page=2&qid=1661366320&ref=sr_pg_1,B07NQNCKTW,$,-9.0,https://m.media-amazon.com/images/I/61oAztaWNmL._AC_UL1500_.jpg,,HVC 2 Youth White/Red/Royal Wrestling Shoes 13,18,49.98,High Top Boxing Shoes,nan,4.6,https://www.amazon.com/adidas-Youth-White-Royal-Wrestling/dp/B07NQNCKTW
https://www.amazon.com/s?k=High+Top+Boxing+Shoes&page=2&qid=1661366320&ref=sr_pg_1,B081SJC9YX,$,,https://m.media-amazon.com/images/I/71KDblbYjzL._AC_UL1500_.jpg,,Men's Hyde Low Top Casual Skate Shoe,478,60.0,High Top Boxing Shoes,nan,4.6,https://www.amazon.com/DC-Mens-Skateboard-Skate-Black/dp/B081SJC9YX
https://www.amazon.com/s?k=High+Top+Boxing+Shoes&page=2&qid=1661366320&ref=sr_pg_1,B08MQZLFF3,$,,https://m.media-amazon.com/images/I/816+RjLAzmL._AC_UL1500_.jpg,,Pro Boxing Shoe for Men & Women,631,119.0,High Top Boxing Shoes,nan,4.5,https://www.amazon.com/Hayabusa-Pro-Boxing-Shoe-Women/dp/B08MQZLFF3
https://www.amazon.com/s?k=High+Top+Boxing+Shoes&page=2&qid=1661366320&ref=sr_pg_1,B086JFPPVY,$,,https://m.media-amazon.com/images/I/8139fI14AqS._AC_UL1500_.jpg,,High Top Running Shoes for Men Lightweight Breathable Mesh Walking Athletic Sneakers,961,69.99,High Top Boxing Shoes,nan,4.4,https://www.amazon.com/Soulsfeng-Lightweight-Breathable-Athletic-Sneakers/dp/B086JFPPVY
https://www.amazon.com/s?k=High+Top+Boxing+Shoes&page=2&qid=1661366320&ref=sr_pg_1,B07JQBFHRJ,$,,https://m.media-amazon.com/images/I/61vE-25vLKL._AC_UL1500_.jpg,,PIVT Low Top Boxing Shoes,223,89.99,High Top Boxing Shoes,nan,4.6,https://www.amazon.com/Everlast-PIVT-Low-Boxing-Shoes/dp/B07JQBFHRJ
https://www.amazon.com/s?k=High+Top+Boxing+Shoes&page=2&qid=1661366320&ref=sr_pg_1,B07JJVC1Y3,$,-18.0,https://m.media-amazon.com/images/I/71HaZGsP9YL._AC_UL1500_.jpg,,Men's Matcontrol Wrestling Shoes,660,69.95,High Top Boxing Shoes,nan,4.6,https://www.amazon.com/ASICS-Matcontrol-Wrestling-Performance-Black/dp/B07JJVC1Y3
https://www.amazon.com/s?k=High+Top+Boxing+Shoes&page=2&qid=1661366320&ref=sr_pg_1,B09X7923QP,$,,https://m.media-amazon.com/images/I/61e6d8tMkJS._AC_UL1500_.jpg,,"Mens Wrestling Boxing Shoes, High Top Boxing Wrestling Training Shoes Breathable Athletic Shoes for Men Women",,57.99,High Top Boxing Shoes,nan,,https://www.amazon.com/WJFGGXHK-Wrestling-Training-Breathable-Athletic/dp/B09X7923QP
https://www.amazon.com/s?k=High+Top+Boxing+Shoes&page=2&qid=1661366320&ref=sr_pg_1,B08FBB1D9L,$,,https://m.media-amazon.com/images/I/616FPUDxG3L._AC_UL1500_.jpg,,"Wrestling Shoes - High Traction Combat Sport Footwear - Durable Shoes for Wrestlers, Weightlifting Training - Nordic Style Combat Footwear, Athletic Equipment, Lightweight Gym Shoes",383,69.9,High Top Boxing Shoes,nan,4.1,https://www.amazon.com/Core-Wrestling-Shoes-Weightlifting-Lightweight/dp/B08FBB1D9L
https://www.amazon.com/s?k=High+Top+Boxing+Shoes&page=2&qid=1661366320&ref=sr_pg_1,B09SZ8P5HV,,,https://m.media-amazon.com/images/I/71dasT7O+AL._AC_UL1500_.jpg,,"Boxing Shoes, Mens Womens Hi-top Breathable Boxing Boots for Kids, Youth, Adult LS198 Blue",,,High Top Boxing Shoes,nan,,https://www.amazon.com/LUCK-SHOE-Boxing-Womens-Breathable/dp/B09SZ8P5HV
https://www.amazon.com/s?k=High+Top+Boxing+Shoes&page=2&qid=1661366320&ref=sr_pg_1,B00AFLLOPE,$,,https://m.media-amazon.com/images/I/61X7ZrANxnL._AC_UL1500_.jpg,,Leather High Top Lace Up Boxing Shoes - Black,59,179.39,High Top Boxing Shoes,nan,4.1,https://www.amazon.com/Cleto-Reyes-Leather-Boxing-Shoes/dp/B00AFLLOPE
https://www.amazon.com/s?k=High+Top+Boxing+Shoes&page=2&qid=1661366320&ref=sr_pg_1,B09Z711Z7L,$,,https://m.media-amazon.com/images/I/61N0Qq8L7PL._AC_UL1500_.jpg,,"Mens Wrestling Boots, Adult Boxing Shoes Breathable High Tops Weightlifting Boots Non-Slip Boxing Training Shoes",,87.39,High Top Boxing Shoes,nan,,https://www.amazon.com/WJFGGXHK-Wrestling-Breathable-Weightlifting-Non-Slip/dp/B09Z711Z7L
https://www.amazon.com/s?k=High+Top+Boxing+Shoes&page=2&qid=1661366320&ref=sr_pg_1,B095PDK86T,$,,https://m.media-amazon.com/images/I/61bMOcSyD9S._AC_UL1500_.jpg,,Running Shoes Womens Comfortable Fashion Non Slip Sneakers Walking Gym Tennis Sport Athletic Shoes Hip Hop,1119,42.99,High Top Boxing Shoes,nan,4.4,https://www.amazon.com/Hello-MrLin-Comfortable-Sneakers-Athletic/dp/B095PDK86T
https://www.amazon.com/s?k=High+Top+Boxing+Shoes&page=2&qid=1661366320&ref=sr_pg_1,B09ZT23VSV,$,,https://m.media-amazon.com/images/I/61SqpHXw0OL._AC_UL1500_.jpg,,"MINGLU-US Men's Boxing Shoes High-top Fighting Training Shoes and Wrestling Boots, Flying Woven Hollow TPU Seamless Plus Velvet Microfiber Upper, High Elastic EVA Plus Rubber Sole",,91.37,High Top Boxing Shoes,nan,,https://www.amazon.com/MINGLU-US-High-top-Fighting-Wrestling-Microfiber/dp/B09ZT23VSV
https://www.amazon.com/s?k=High+Top+Boxing+Shoes&page=2&qid=1661366320&ref=sr_pg_1,B078MG83DN,$,-8.0,https://m.media-amazon.com/images/I/71VgSPTxPnL._AC_UL1500_.jpg,,Mens Running Shoes Mesh Breathable Lightweight Cushioning Training Athletic Sneakers,3664,54.99,High Top Boxing Shoes,nan,4.5,https://www.amazon.com/Sneakers-Lightweight-Breathable-Training-Traveling/dp/B078MG83DN
