,amazon_search_url,asin,currency,discount_pct,image_urls,images,name,num_of_ratings,price,search_term,search_term_id,star_rating,url,asin_score
5,https://www.amazon.com/s?k=Low+Top+Boxing+Shoes,B0B1ZKF7YG,$,,https://m.media-amazon.com/images/I/71y0C7kpydL._AC_UL1500_.jpg,,mens casual shoes comfortable pu leather fashion sneakers breathable low top walking shoes,283.0,41.99,Low Top Boxing Shoes,,4.4,https://www.amazon.com/ax-boxing-comfortable-sneakers-breathable/dp/b0b1zkf7yg,4
1,https://www.amazon.com/s?k=Low+Top+Boxing+Shoes,B07JPKCFBF,$,,https://m.media-amazon.com/images/I/61vE-25vLKL._AC_UL1500_.jpg,,pivt low top boxing shoes,223.0,89.79,Low Top Boxing Shoes,,4.6,https://www.amazon.com/everlast-pivt-low-boxing-shoes/dp/b07jpkcfbf,4
22,https://www.amazon.com/s?k=Low+Top+Boxing+Shoes,B08BZVYL4M,$,,https://m.media-amazon.com/images/I/81jrqipNvoS._AC_UL1500_.jpg,,all pro boxing shoes   classic crusader series – mid tops   genuine leather   state of the art quality boxing footwear,20.0,79.99,Low Top Boxing Shoes,,4.6,https://www.amazon.com/stallion-new-york-boxing-state/dp/b08bzvyl4m,3
6,https://www.amazon.com/s?k=Low+Top+Boxing+Shoes,B07T89D18J,$,,https://m.media-amazon.com/images/I/51jautzte4L._AC_UL1500_.jpg,,"low top wrestling shoes for men, women and youth, big kids",30.0,49.68,Low Top Boxing Shoes,,4.0,https://www.amazon.com/day-key-wrestling-shoes-children/dp/b07t89d18j,3
20,https://www.amazon.com/s?k=Low+Top+Boxing+Shoes,B08GYQM6J5,$,-23.0,https://m.media-amazon.com/images/I/71qOGzXG4ZL._AC_UL1500_.jpg,,men’s low top canvas walking shoes lace up fashion sneakers casual,1684.0,23.99,Low Top Boxing Shoes,,4.3,https://www.amazon.com/yageyan-canvas-lace-up-fashion-sneakers/dp/b08gyqm6j5,3
4,https://www.amazon.com/s?k=Low+Top+Boxing+Shoes,B072JGTM91,$,,https://m.media-amazon.com/images/I/51+M+so6FqL._AC_UL1500_.jpg,,unisexs low top adi kick i martial arts taekwondo karate training shoes trainers,1172.0,79.95,Low Top Boxing Shoes,,4.5,https://www.amazon.com/adidas-adi-kick-martial-shoes-sneaker/dp/b072jgtm91,3
2,https://www.amazon.com/s?k=Low+Top+Boxing+Shoes,B007YJYNY4,$,,https://m.media-amazon.com/images/I/81jaTXVDymL._AC_UL1500_.jpg,,diablo wrestling boxing shoes,219.0,69.99,Low Top Boxing Shoes,,4.1,https://www.amazon.com/ringside-top-boxing-shoe-black/dp/b007yjyny4,3
11,https://www.amazon.com/s?k=Low+Top+Boxing+Shoes,B07C9LG958,$,,https://m.media-amazon.com/images/I/71sGwokyEHL._AC_UL1500_.jpg,,"new elite high top boxing shoes   black, blue, red",625.0,99.69,Low Top Boxing Shoes,,4.7,https://www.amazon.com/everlast-elite-high-boxing-shoes/dp/b07c9lg958,3
13,https://www.amazon.com/s?k=Low+Top+Boxing+Shoes,B01NCPZ2VQ,$,,https://m.media-amazon.com/images/I/71RIj29PWuL._AC_UL1500_.jpg,,"title speed flex encore mid boxing shoes, black, 8",56.0,54.99,Low Top Boxing Shoes,,4.2,https://www.amazon.com/title-speed-flex-encore-boxing-shoes/dp/b01ncpz2vq,2
3,https://www.amazon.com/s?k=Low+Top+Boxing+Shoes,B09DFYL1CK,$,,https://m.media-amazon.com/images/I/71N3urU993L._AC_UL1500_.jpg,,fistrage leather kick boxing shoes fighting sports master training mesh unisex pro mens and youth genuine boot light weight | black color boxing shoes for adults,198.0,41.99,Low Top Boxing Shoes,,4.2,https://www.amazon.com/fistrage-leather-fighting-training-genuine/dp/b09dfyl1ck,2
26,https://www.amazon.com/Ringside-Diablo-Wrestling-Boxing-Shoes/dp/B00M1UAQG0,B00M1UAQG0,$,,"https://m.media-amazon.com/images/I/51drK3B8awL._AC_UL1500_.jpg,https://m.media-amazon.com/images/I/51gq5sVqDqL._AC_UL1500_.jpg",,ringside diablo wrestling boxing shoes,271.0,51.16,Low Top Boxing Shoes,,4.1,https://www.amazon.com/ringside-diablo-wrestling-boxing-shoes/dp/b00m1uaqg0,2
7,https://www.amazon.com/s?k=Low+Top+Boxing+Shoes,B08MQZLFF3,$,,https://m.media-amazon.com/images/I/816+RjLAzmL._AC_UL1500_.jpg,,pro boxing shoe for men & women,631.0,119.0,Low Top Boxing Shoes,,4.5,https://www.amazon.com/hayabusa-pro-boxing-shoe-women/dp/b08mqzlff3,2
16,https://www.amazon.com/s?k=Low+Top+Boxing+Shoes,B08LKZTXC1,$,,https://m.media-amazon.com/images/I/71i2nhSJkkL._AC_UL1500_.jpg,,mens casual shoes fashion sneakers breathable comfort walking shoes for male,2925.0,43.99,Low Top Boxing Shoes,,4.3,https://www.amazon.com/ax-boxing-sneakers-breathable-numeric_10/dp/b08lkztxc1,2
9,https://www.amazon.com/s?k=Low+Top+Boxing+Shoes,B096FG7SM2,$,,https://m.media-amazon.com/images/I/613O1FBybDS._AC_UL1500_.jpg,,jb elite v,288.0,124.95,Low Top Boxing Shoes,,4.8,https://www.amazon.com/asics-elite-wrestling-shoes-black/dp/b096fg7sm2,1
14,https://www.amazon.com/s?k=Low+Top+Boxing+Shoes,B01BPL5WF0,$,-13.0,https://m.media-amazon.com/images/I/61vUTY5yA0L._AC_UL1500_.jpg,,"mens hvc wrestling shoe, black/white/iron metallic, 12",271.0,52.49,Low Top Boxing Shoes,,4.5,https://www.amazon.com/adidas-wrestling-ankle-strap-black/dp/b01bpl5wf0,1
8,https://www.amazon.com/s?k=Low+Top+Boxing+Shoes,B07K9CDZCB,$,-13.0,https://m.media-amazon.com/images/I/81h8LEsDoTL._AC_UL1500_.jpg,,mens matflex 6 wrestling shoes,5595.0,54.99,Low Top Boxing Shoes,,4.4,https://www.amazon.com/asics-matflex-wrestling-shoes-silver/dp/b07k9cdzcb,1
12,https://www.amazon.com/s?k=Low+Top+Boxing+Shoes,B004BUSU0M,$,-7.0,https://m.media-amazon.com/images/I/51VUOxW155L._AC_UL1500_.jpg,,mens speedsweep vii wrestling shoes,250.0,70.45,Low Top Boxing Shoes,,4.4,https://www.amazon.com/nike-o0057flkus884497166018-nike-speedsweep-vii/dp/b004busu0m,1
21,https://www.amazon.com/s?k=Low+Top+Boxing+Shoes,B08FB8XG9M,$,,https://m.media-amazon.com/images/I/616FPUDxG3L._AC_UL1500_.jpg,,"wrestling shoes   high traction combat sport footwear   durable shoes for wrestlers, weightlifting training   nordic style combat footwear, athletic equipment, lightweight gym shoes",383.0,69.9,Low Top Boxing Shoes,,4.1,https://www.amazon.com/core-wrestling-shoes-weightlifting-lightweight/dp/b08fb8xg9m,1
15,https://www.amazon.com/s?k=Low+Top+Boxing+Shoes,B083QTL4TH,$,,https://m.media-amazon.com/images/I/81Qb1jMIyCL._AC_UL1500_.jpg,,mens matcontrol 2 wrestling shoes,802.0,84.73,Low Top Boxing Shoes,,4.6,https://www.amazon.com/asics-matcontrol-asics-blue-white/dp/b083qtl4th,1
25,https://www.amazon.com/s?k=Low+Top+Boxing+Shoes,B01BPL5WVE,$,-13.0,https://m.media-amazon.com/images/I/61TaebYLZyL._AC_UL1500_.jpg,,"mens hvc wrestling shoe, black/white/iron metallic, 12.5",109.0,52.47,Low Top Boxing Shoes,,4.6,https://www.amazon.com/adidas-wrestling-ankle-strap-black/dp/b01bpl5wve,1
17,https://www.amazon.com/s?k=Low+Top+Boxing+Shoes,B01BPL5YR6,$,,https://m.media-amazon.com/images/I/61TaebYLZyL._AC_UL1500_.jpg,,"mens hvc wrestling shoe, black/white/iron metallic, 15",70.0,58.63,Low Top Boxing Shoes,,4.4,https://www.amazon.com/adidas-wrestling-ankle-strap-black/dp/b01bpl5yr6,1
23,https://www.amazon.com/s?k=Low+Top+Boxing+Shoes,B07NQNSSFH,$,-5.0,https://m.media-amazon.com/images/I/91fOhnFADvL._AC_UL1500_.jpg,,"mens hvc wrestling shoe, white/royal/red, 7.5",54.0,56.92,Low Top Boxing Shoes,,4.8,https://www.amazon.com/adidas-wrestling-ankle-strap-white/dp/b07nqnssfh,1
24,https://www.amazon.com/s?k=Low+Top+Boxing+Shoes,B07457ZBHL,$,,https://m.media-amazon.com/images/I/51MvRaJkcsS._AC_UL1500_.jpg,,mens inflict 3 wrestling shoes,54.0,160.96,Low Top Boxing Shoes,,4.5,https://www.amazon.com/nika-inflict-wrestling-shoes-black/dp/b07457zbhl,1
18,https://www.amazon.com/s?k=Low+Top+Boxing+Shoes,B07BJ124J3,$,,https://m.media-amazon.com/images/I/81b-hi9i4eL._AC_UL1500_.jpg,,"mens boys hvc2 wrestling mat shoe ankle strap (light gray/onyx, 11.5)",50.0,62.19,Low Top Boxing Shoes,,4.1,https://www.amazon.com/adidas-wrestling-ankle-strap-light/dp/b07bj124j3,1
10,https://www.amazon.com/s?k=Low+Top+Boxing+Shoes,B01BPL5RVY,$,-13.0,https://m.media-amazon.com/images/I/51ujhsCXuRL._AC_UL1500_.jpg,,wrestling hvc youth laced wrestling shoe (toddler/little kid/big kid),4399.0,52.32,Low Top Boxing Shoes,,4.6,https://www.amazon.com/adidas-wrestling-ankle-strap-black/dp/b01bpl5rvy,1
19,https://www.amazon.com/s?k=Low+Top+Boxing+Shoes,B000CER6TC,$,-14.0,https://m.media-amazon.com/images/I/61nJMsTUXdL._AC_UL1500_.jpg,,mens samba classic,16052.0,59.99,Low Top Boxing Shoes,,4.6,https://www.amazon.com/adidas-samba-classic-shoes-mens/dp/b000cer6tc,1
